Username,Reviews
Miiley,"Aku pakai ini sebagai pengganti body lotion actually, kinda love it karena berasa melembapkan tanpa lengket² di badan feels nya basah aja gitu. Tapi jujur kalau untuk muka, jujur aku ga suka. Malah bikin jadi over minyakan padahal pas pakai ini, kulit muka aku lagi normal, cuma dehydrated aja. Well, it's not a bad product."
biasome,"dulu ini hype banget. sempet cobain beberapa lama. isinya banyak bgt tapi ternyata ga cocok pake ini. mungkin aku juga salah makenya semuka. alhasil jadi timbul jerawat. teksturnya kayak gel pada umumnya, kalo ditaro di kulkas ada sensasi coolingnya juga"
wintermaze,"moistnya nature republic ini, ya biasa aja sih, first moist deh lupa juga, ukuran gentong, jadi lama habisnya, gak ada efek aneh aneh sih, melembapkan iya, tapi ya biasa aja, ada efek cooling nya juga"
widyagnesia,"Tekstur agak kental gitu guys tapi pas dipake ada sensasi dingin adem gituu deh mantep banget, ini juga bisa ilangin bruntusan di aku, pokoknya mantul banget deh kalian harus cobain untuk yg punya bruntusan juga hihi dijamin gak nyesel nyoba produk satu ini~"
kahlaqolbi,"awalnya coba karena sempet viral tapi beneran bagus sih, kalau lagi sensitiv pake ini suka jadi langsung tenang lagi mukanya, bau alkoholnya lumayan nyegak sih tapi:( tapi overall bagus buat nenangin muka yang lagi merah-merah"
mellindabe,"Kemasan jar dengan ukuran yang besar, gak terlalu ngefek apa² di aku malah kadang bikin beruntusan di kening, untuk pemakaian lama banget gak habis² bahkan sampai kadaluarsa pun masih banyak isinya, harganya lumayan ya, aku beli pas harganya 88rb, aku gak akan repurchase lg sih hehe"
Kurniaarilia,"Aku udah pake ini dari lamaaa, mostlyy kulitku lembab banget jadinyaaaa… bekas jerawat juga pudar. Telsturnya kenyalk gituuu tapi kalau udah taruh di wajah jadi mencair koo. Recommended banget! Apalagi isinya banyaak jadi bisaaa dipake berbulan-bulan hihi"
putiapp,"Ini pelembab yang ringan seperti air, tapi cepat meresap ke kulit. Karna isinya sebanyak itu aku selalu pakai 3-5 kali dlaam sehari. Ini mencerahkan tapi kita harus sabar. Gk nyesel pakai ini sampai setahun lebih."
beautyeontan,sampe sekarang masih pake. adekku juga make dulu wkwk. dulu make ini aku barengin sama masker kek spirulina. skincare pertama aku itu ini. dulu belom paham urutan skincare kek apa. cuma tau cuci muka. akibat pake ini jadi tau skincare apaan. rasa ademnya itu lho adem bangett.
Nblyprtw,"Tekstur Kenyal di kulit ,rasa nya adem gitu dan bangun tidur wajah tampak seger. Cocok jenis untuk semua tipe kulit,cocok sebagai step skincare ,digunakan pada malam hari dan pagi hari dapat hasilnya,cocok sebagai moisturizer ketika mau makeup juga"
cheonsa,"Melembapkan Kulit meresap tanpa meninggalkan rasa lengket, membuat kulit terasa segar dan lembap.Dapat digunakan sebagai pelembap wajah, masker rambut, soothing gel setelah bercukur, bahkan sebagai perawatan kulit yang terbakar matahari.Cocok untuk Semua Jenis Kulit: Aman untuk kulit sensitif dan membantu mengurangi kemerahan atau iritasi.Setelah penggunaan rutin, kulit terasa lebih halus, terhidrasi, dan terlihat lebih sehat. Produk ini juga membantu mengatasi kulit kering dan menjaga elastisitas kulit."
annisanubari,"moisturizer pertamaku saat terjun ke dunia perskincarean, dulu ini viral banget dimana-mana sampe banyak fakenya 😭aku pake yang bentukan tube sebenernya dan dimasukkan ke kulkas dulu. awal pake oke seger, dingin. pas setelahnya ampus panas dan perih banget di kulit sensitifku, gaada efek melembapkan apapun juga. rasanya makin lama mukaku keliatan jadi gosong huaa. kayaknya efek dari alkohol & parfum yang kenceng sih. mau ganti tapi kayak gatau banget ganti apa lagi, karena seminim itu pengetahuanku dulu, jadi kupake cuma setengah. udahlah mana lengket banget susah menyerapaku ndak mau coba2 lagi sih, buat pembelajaran aja. sekarang mau pakenya yang lokal2 ajadeh sesuai kebutuhan kulit orang indonesia"
Anpdo0_,"Ini moisturizer pertama kali aku didunia perskincarean, waktu permasalahn wajah kubitu brutusan, ampuh bgt ngilangin jerawat yg kecil” dijidat karena ini ada sifat calming nya jadi meredakan kemerahan juga dan lidah buaya buat me moisturizer kulit, cocok banget buat remaja yang baru new di dunia perskincare an 🫶🏻"
cleodoracita,"Pakai produk ini sangat amat berguna banget. Bener bener multipurpose dari pemakaian untuk skincare atau bodycare bahkan wound healing aja bisaaaa!! Adem bangett anyessss, ga lengkett dan wateryy bangettt. Aromanya wangiii soft dan ga norakk"
ratuudyaaa,"Awal beli karna lg viral²nya ini, dari segi isi ini banyakk bangettt dan biasa aku pake buat badan ataupun wajah sesekali aku jadiin masker rambut wkwk. Kulit badanku kering kl dipakein ini bener² melembabkan banget ngebantu biar ga kering dan wanginya juga seger enakeun lah"
dini255,"Pertamakali aku pake ini karena keracunan temen kuliah, sangat bagus untuk melembabkan wajah untuk yg memiliki type wajah kering, bonusnya rambut dibagian kening jdi lebat, karena bekas pake moisnya suka aku olesin ke rambut wkwkwkw"
ajengkvr,"Nature Republic Aloe Vera 92% Soothing Gel sangat melembapkan, cepat meresap, dan memberikan efek menenangkan pada kulit. Bisa digunakan untuk wajah, tubuh, dan rambut. Wanginya lembut, segar, dan tidak lengket. Harganya terjangkau dengan isi banyak. Produk ini benar-benar worth it!"
tiwipassa,Gatau kenapa di aku ini ga cocok. Mungkin karna ada alkoholnya. Kulitku yg sensitif ini langsung bereaksi kalo pake ini di muka. Kalo pake di badan aman sih cuma kalo di muka ga cocok. Efek ga cocok nya yg paling aku ga suka tuh efek panas. Yes panas kek kebakar (cuma ga sepanas itu). Terus langsung beruntusan. Karna masih banyak kadang aku pake di kepala dan di badan aja daripada sayang
anggi89,Ini produk legend menurut aku.aku pakai saat muka aku lagi parahnya jerawatan.bingung harus pakai moisturizer apa.akhirnya ketemu dengan produk ini dan hasilnya bagus banget.menenangkan kulit saat di pakai ada sensasi dingin.dengan tekstur gel jadi mudah meresap dan sangat aman di kulit berminyak aku.mungkin minusnya di packaging menurut aku akan lebih praktis dan higienis menggukana kemasan tube
wdhara,"Awal-awal booming karena BAnya artis sokor dan waktu itu korea2an jg booming bgt, akhirnya aku kepo buat cobain karena baca-baca reviewnya sih mantul tetapi waktu aku pakai sendiri sih gak ada efek apa-apa di muka aku. Harganya dulu lumayan untuk aku yg masih mahasiswa tetapi abis itu aku gak repurchase."
riskifirdayanti44,"bikin muka ku gk kering lagi,teksturnya yang gk lengket diwaja,bikin bisa cerah juga,cocok banget dipakai saat wajah lagi kering dan peradangan akibat jerawat.terjangkau juga untuk harganya recommended banget buat kalian,apalagi buat kantong pelajar."
shaanshaan,"Adem dibuka calming bgt. Cocok sih apalagi dipake pas abis bersihin muka berasa tenang bgt. Ga bruntusan di aku. Cocok aja, jerawat juga bisa kempes kalau pemakaian rutin. Mau kok beli lagi. Kemasannya gede jd ga abis2. Agak susah sih dibawa traveling harus beli kemasan kecil lg buat dibawa berpgian"
zahra_btari,"Worth the price banget, bikin kulit lembab walaupun tipe kulitku berminyak tapi tetap enak dipake. Sensasi cooling nya enak banget ke kulit, mudah meresap juga. Gak lengket sama sekali dikulit, ringan juga di kulit. Pokonya kalian harus coba sih"
yandhi,"Natur republik dari Aloevera sangat rekomendasi banget dan cocok.Fisik bisa dirubah, materi bisa di cari tapi event SXB tidak datang dua kali.Jeeegg menyala wiiii SXB nih bosssss tampleng dongggggHaduh sudahpasnih 200 karakter 12345"
Ajengpramesta,Bagus pokoknya terus juga gampang banget dhdjsjjsjsjsjsjsjjsksksksksksjsjsjsjsjsjsjsjsjsjsjsjjsjsjdjdjsjsjsjjjjjkkkkkkkkkkkkkkjkkkkkkkkkkkkkkkkkkkkkkkkkkkkkkkkmmmmmmmmkkkkkkkkkkkkkkkkkkkkkkkkkkkkkkkkkkkkkkk
Anita_vj,"Good pokoknya top bnget dah, kerennnnnnn banget mamtappppp gaeessssss yuk beliiiiiiii otw langsung x beauty, bagusssssssssss pollllllllllllllllllllllll mantap sukaaaa Aaaaa@aaaaaaaaaaaaaaaaaaaaaaaaaaaaaaaaaaaaaaaaasaaaaas"
lilyhehe_,"Saya telah menggunakan Nature Republic Aloe Vera selama beberapa minggu sekarang, dan saya sangat puas dengan hasilnya. Produk ini dirancang untuk membantu melembabkan dan menenangkan kulit yang kering dan iritasi.1. _Melembabkan kulit_: Aloe vera dalam produk ini sangat efektif dalam melembabkan kulit yang kering dan rusak.2. _Membantu menenangkan kulit_: Produk ini membantu menenangkan kulit yang iritasi dan meradang.3. _Tidak berminyak_: Nature Republic Aloe Vera tidak berminyak dan tidak meninggalkan residu pada kulit.4. _Hypoallergenic_: Produk ini hypoallergenic, sehingga aman digunakan pada kulit yang sensitif."
mayaems2905,"Suka banget ama Produk Natrep ini bikin Wajah Adem, Seger dan Nyaman banget. Aku paling suka dipakai pas siang2 bikin Mukaku yg Kering jd Lembab Maksimal. Bisa juga buat Malam hari pengganti sleeping mask cakep poll enak dikulit rkngan gk lengket"
amaliachakul,"baru kembali lagi pakai product ini setelah beralih ke sunscreen merk lain, tapi aku rasa akan stuck di sunscreen ini kedepannya karna cocok di kulit acne dan oily ku, ga buat wajah ku semakin berminyak dan ga buat jadi kusam, dan kemerahan karna bekas dan jerawatku juga berangsur membaik dan pastinya ini gentle di kulit ku, repurchase? ofc, harganya juga masih terjangkau menurutku"
Chessya_Cholifahsari,"BAGUSS, melembapkan sekali, gampang didapet............................ ........ ..............................................................................................................................."
Rahmahania,"Natrep ini salah satu prodyk yg bagus banget, dia melembabkan kulit dan menghidrasi kulit dan bisa banget membuat wajah cerah alami. Natrep produk korea yang mengesankan dan bagus banget dipakai daily, cocok buat kulit remaja dan yg baru nyoba pakai skinker"
Fina130501,"udah pkai kesekian kalinya emang sebagus itu, cobain deh , buruan rasain keajaibannya, beli sekarang dan dapatkan promonya, produk terbaik jossss josss joss josss josss josss josss josss josss josss josss josss josss gass beli belii beli"
DurotulFatimah88,"Produk ini sangat ringan, tidak lengket dan mudah menyerap. Saya biasa menggunakan produk ini untuk kulit saya yang suka kering. Setwlah pemakaian rutin hasilnya kulit saya jauh lebih terhidrasi dan lebih lembut. Sangat di rekomended banget"
elsamnr,"Untuk produk ini sangat bagus sekali, kandungannya bagus untuk di muka kering, dan tekstur nya ringan tidak lengket setelah dipakai. Membuat kulit jadi lembut dan bersih, dan ternyata kegunaannya banyak sekali tidak untuk di muka saja,"
shabinaks,Semenjak saya memakai ini kulit saya jadi membaik tidak ada jerawat dan makin putuh dan halus tidak ada bintik bintik Semenjak saya memakai ini kulit saya jadi membaik tidak ada jerawat dan makin putuh dan halus tidak ada bintik bintik terimkasih
silsistria,"Product nature republic yang satu ini buat candu karena bisa buat kulit sensitif, calming ketika terik matahari dan pelembab habis exfoliasi cocok banget, aku rekomendasikan ini buat temen temen yang butuh buat kulit kemerahan dan butuh calming"
ziva01,Very nice comfortable and safe for sensitive skinIt'sso good and worth to buy honestlythe best micellar water ever!! Do repeat purchase again you will never regret nice!!!and even the ingredientsare all safe so I love it so much and also it'slighton skin
noviaaia,"Nature republic bisa melembapkan kulit kemudian membuat kulit lebih kencang dan nampak cerah, glowing dan sehat. Banyak manfaat yg aku proleh menggunakan produk inu pokonya oke banget pake produk ini keren banget produk ini juara bintang 5"
Ismacoii,"bagusssss banggeettt aku suka sama produk inikerja banget di kulitku, tekaturnya lembut dan adem waktu di pakai pas banget di pakai pas kondisi kulitku kering krontang, dan sampai sekarang suka repaet order katena sebagus itu memang produknya"
Masyitah100402,"Wah bener-bener enak banget, sangat cocok di kulit aku. Bisa untuk melembabkan kulit aku. Biasanya aku pakai untukwajah sebagai pelembab dan aku pakai sebagai pelembab kulit tangan juga kaki setelah mandi. Rasanya mantap betul mantel deh"
aulianailaturr,"produk baik, baik digunakan di kulit.produk baik, baik digunakan di kulit.produk baik, baik digunakan di kulit.produk baik, baik digunakan di kulit.produk baik, baik digunakan di kulit.produk baik, baik digunakan di kulit.produk baik, baik digunakan di kulit."
maolllnk,bagusssssssssssssssssssssssssssssssssssssssssssssssssssssssssssssssssssssssssssssssssssssssssssssssssssssssssssssssssssssssssssssssssssssssssssssssssssssssssssssssssssssssssssssssssssssssssssssssssssssssssssssssssssssssssssss
TW2025,Produk yang llayak ibeleimmmmmmmSippppmmmmmAaaaaaakkkkkMmmmmmmMmmmmmmmmmmmmmmmBnnnnnnnnnnnnnnnnnnnnmmmmmmmmmmmmmqķmkkkkklllllllllllkkkkkkldjjjjjjjjjjjjjiiiiiiiiiiiiiiiiiiiiiiiiiiiiiiiikikkikiiiiiiiiiiiiii
Nimasryan,"Untuk kulit kering cocok banget pakai produk ini karena teksturnya dingin ,moist dan tidak lengket. Untuk pemakaian yang lebih nyaman kalian bisa tarus dulu produknya di kulkas baru kemudian dipakai . Bisa digunakan pagi ,siang ,sore maupun malam hari. Love it !"
Dytaamanda,Setelah aku pake mukaku lebih lembab..............................untuk harganya lebih murah dari produk pelembab lainnya jadi kita sebeagai pelajar lebih suka dengan harga murah dan menguntungkan kita sebagai pengguna produk tersevut
Arifdr,"packaging besar, awet banget bisa sampe setahunann melembabkan juga dikulit cocok buat kulit kering, bisa di pakai segala usia, bisa dipakai siang dan malam haribisa melembabkan semuaa sisi yang kering, pokonya recomennd banget dahhh"
intannnnninu00,"Enak bangett ada sensasi dingin gtuu biasanya aku pake buat daily moist kadang buat face massage jugaa, terus bisa juga buat peeling komedo yang ada di hidung, cocok buat kulit normal atau kulit yang dry skin gitu deh, recomend banget buat dibeli😍😍😍🥰🥰🥰🥰"
riekeamaylinda12_,"bikin lembab banget, gabikin kering, gabikin kusen, gabikin berminyak, bagus banget pokonya cocok di aku, udah make lebih dari q tahun produknya the best pokonya, first time pake udah cocok akhirnya repurchase order lagi terus setiap produk habis"
Waoderani20,"Efeknya bikin lembab di kulit, teksturnya ringan banget, kemasan nya juga gede untuk harga produk gel, bagus banget dan cocok di kulit yang oily kayak aku gini. Rekomendasi banget dah pokoknya produk"" dari nature republic ini best poll ❤️"
irgisalwati,"Aku pernah coba Nature Republic Aloe Vera 92% Soothing Gel, dan menurutku ini produk yang bagus, terutama buat yang butuh pelembap ringan dan serbaguna. Teksturnya gel bening, terasa dingin di kulit, dan cepat meresap tanpa rasa lengket. Aku paling suka pakai setelah cuci muka atau setelah terkena sinar matahari karena bikin kulit jadi lebih adem dan segar.Produk ini juga bisa dipakai untuk banyak hal, seperti pelembap wajah, masker, body lotion, bahkan untuk rambut atau setelah bercukur. Kalau kulit lagi kering, gel ini bantu bikin lebih lembap tanpa terasa berat.Tapi, ada hal yang kurang aku suka. Gel ini ada kandungan alkohol dan parfum, jadi mungkin kurang cocok buat kulit yang sensitif. Selain itu, kemasannya berbentuk jar tanpa spatula, jadi harus lebih hati-hati supaya tetap higienis.Secara keseluruhan, ini produk yang oke dengan harga terjangkau. Cocok buat yang cari pelembap ringan dan bisa dipakai untuk banyak keperluan!"
amarasaq7,"Sangat bagus dehydrated dan calming sekaliiii, sangat rekomended untuk kulit oily dan kering, tekstur kenyal, dingin apalagi kalau habis keluar dari kulkas sangat suka sekaliiiiii, sering sekali repurchase buat beli lagi dan lagiiii"
a_octaa,"Nge calming banget di kulit aku, bisa ngelembab in juga dan suka kubikin jadi masker. Udah lebih dari 2 tahun pake ini dan udah bener bener cocok banget dibaku dan ga mau ganti ganti lagi. Rekomended untuk kulit kombinasi dan dia juga ga bikin breakout di wajah"
aini015,"SALAH SATU ALOEVERA VIRAL PADA ZAMANNYA, teksturnya cair dan mudah banget meresap ke kulit. ga ketarik samsek dan harganya aman dikantong pelajar, trs bisa multifungsi juga ga harus dipakek di muka aja, di kaki, tangan, kuku, rambut & area badan lainnya juga bisa"
Ndaaaa19,"Produk ini sangat bangus sekali karna bertekstur gel jadi gampang di aplikasikan, karna nyaman di pakai dan membuat kulit kita lebih sehat dan lebih bagis sehingga gampang di aplikasikan dan nyaman sekali untuk di pakai dalam kondisi apapun"
nahdahzz,"Sangatt baik dgunakan, bisa digunakan dilain aktivitas sangat saya rekomendasikan untuk semua, ayo segera memaka ini karena sangat worth it. Bagus jugaaa dan murahhhhh affordable ayooo gunakan iniiiiiii segera sebelum kehabisaaaannn"
fathiasm,"Produk pereda kemeragan yang mudah menyerap ringan dan tidak ada white cas dan dengan harga yang terjangkau dan mudah di dapatkan baik online maupun offline, water base jadi produk sangat mudah menyerap, namun kurang cocok di orang dengan keringat berlebih"
rvinap,Teksturnya gel mudah banget menyerap bisa dipakai jadi base skincare bisa juga buat masker. Adem banget pas dipake. Ukurannya juga besar. Worth it banget. Bahannya enak banget. Harganya terjangkau juga. Bagus bikin melembabkan. Sangat mudah dibland
fadhilaha_,pernah pakai produk ini dan bagus banget harga terjangkau juga sangat worth to buy sekalii wajib banget cobain produk ini ramah di kantong dan testimoni nya juga sudah terpercaya banget. terima kasih semoga terus jaya dan semakij banyak promo nya
Kikikmuktii,"Produk aloe vera merupakan pilihan yang sangat baik untuk merawat kulit, baik digunakan untuk keperluan kecantikan maupun kesehatan. Aloe vera, yang dikenal dengan manfaat menenangkan dan melembapkan, telah digunakan selama ribuan tahun untuk berbagai kebutuhan. Produk aloe vera yang berkualitas biasanya mengandung ekstrak aloe vera murni yang dapat memberikan kelembapan intensif pada kulit, mempercepat proses penyembuhan luka ringan, serta meredakan peradangan akibat iritasi atau terbakar sinar matahari.Teksturnya yang ringan dan cepat meresap membuatnya nyaman digunakan sehari-hari, tanpa rasa lengket. Selain itu, aloe vera juga dapat digunakan pada kulit wajah maupun tubuh, bahkan rambut, karena sifatnya yang menenangkan dan tidak menyebabkan iritasi pada kulit sensitif. Beberapa produk juga dilengkapi dengan bahan tambahan seperti vitamin E atau minyak alami yang semakin meningkatkan manfaatnya.Namun, penting untuk memastikan bahwa produk aloe vera yang digunakan mengandung bahan alami yang cukup tinggi, tanpa bahan pengawet atau pewarna sintetis yang dapat merusak manfaat alaminya. Secara keseluruhan, produk aloe vera sangat cocok untuk mereka yang mencari solusi perawatan kulit alami dan efektif, dengan harga yang terjangkau."
weggamj,"Selama pakai produk ini kulit lebih sehat dan terawat, saya akan membeli produk ini lagi, dan menggunakan rangkaian produk lainnya, semoga semakin banyak variant produk ini. Saya akan merekomendasikan produk ini kepada teman teman saya"
rahmamukti,"Produk aloe vera merupakan pilihan yang sangat baik untuk merawat kulit, baik digunakan untuk keperluan kecantikan maupun kesehatan. Aloe vera, yang dikenal dengan manfaat menenangkan dan melembapkan, telah digunakan selama ribuan tahun untuk berbagai kebutuhan. Produk aloe vera yang berkualitas biasanya mengandung ekstrak aloe vera murni yang dapat memberikan kelembapan intensif pada kulit, mempercepat proses penyembuhan luka ringan, serta meredakan peradangan akibat iritasi atau terbakar sinar matahari.Teksturnya yang ringan dan cepat meresap membuatnya nyaman digunakan sehari-hari, tanpa rasa lengket. Selain itu, aloe vera juga dapat digunakan pada kulit wajah maupun tubuh, bahkan rambut, karena sifatnya yang menenangkan dan tidak menyebabkan iritasi pada kulit sensitif. Beberapa produk juga dilengkapi dengan bahan tambahan seperti vitamin E atau minyak alami yang semakin meningkatkan manfaatnya.Namun, penting untuk memastikan bahwa produk aloe vera yang digunakan mengandung bahan alami yang cukup tinggi, tanpa bahan pengawet atau pewarna sintetis yang dapat merusak manfaat alaminya. Secara keseluruhan, produk aloe vera sangat cocok untuk mereka yang mencari solusi perawatan kulit alami dan efektif, dengan harga yang terjangkau."
FiqihPavita,"Pertama kali coba pakai gel ini langsungsuka. Karena begitu dipake, langsungterasa dingin menyejukkan dan langsungmeresap. Jadi ngga lengket di kulit. Kemasannya juga aman buat dibawa kemana-mana. Harganya sesuai dengan produknya"
Nurrochmawati24,"Kulitjadi lembab saat memakai ini. Bisa untuk mostruraizer. Cocok untuk digunakan sehari hari atau sebelum tidur. Tapiharus hati harikalau beli takut yang dibeli bukan barang yang ORI. Karna kalau nggk ORI bisa bikin kulit rusak, berjerawat"
Miamizm,"seger banget ga ada yg bisa ngalahin masker ini seger pol, gentle juga dan berasa cerahan banget abis pake ini. recommended buat kalian yg ngerasa kusem banget karena masker ini dipake semalem langsung besoknya cerah banget worth it worth it"
amrimuhammad_,"Tektur cair , mudah meresap , ringan , dingin saat dipakai , mudah digunakan harga terjangkau kalian bisa temukan dan beli dimana saja ayok bisa coba buat masker mau tidur bangun pagi langsung halus di muka dan bikin cerah juga kalian wajib coba"
zachan,"menjadi pilihan tepat bagi yang memiliki kulit kering dan dehidrasi. Produk ini mengandung Hyaluronic Acid, Ceramide, dan Aloe Vera yang membantu menjaga kelembapan kulit sepanjang hari. Teksturnya ringan, tidak lengket, dan cepat meresap, sehingga nyaman digunakan, baik pagi maupun malam.Setelah pemakaian selama satu minggu, kulit terasa lebih kenyal dan terhidrasi dengan baik. Garis halus akibat dehidrasi juga mulai berkurang. Produk ini tidak memiliki kandungan fragrance, sehingga aman bagi kulit sensitif. Namun, bagi pemilik kulit berminyak, mungkin akan terasa sedikit berat jika tidak diimbangi dengan penggunaan toner yang ringan.Kemasannya berbentuk jar dengan tutup putar, sehingga perlu menggunakan spatula agar lebih higienis. Harganya cukup terjangkau dengan isi yang cukup banyak. Secara keseluruhan, moisturizer ini cocok bagi yang mencari pelembap dengan hidrasi maksimal tanpa efek greasy berlebihan."
rasyabintang_03,"Produk sangat nyaman di pakai, melembabkan dan sangat menghidrasi kulit yang kering Dipakai dengan cara masker sangat bagus hasilnya mengenyalkan dan isinya banyak tidak mengecewakan memakai produk aloevera lida buaya ini sangat bagus"
kairrzaar,"aslinya ye jujur aje dulu ni beli gr gr fomo ama org org, tp wow ternyata emg pantes rame dulu, melembabkan cmn ya gitu kalo dibandingin sm skincare lain buat skrg agak kureng tp overall boleh lah bleh bleh cobain ges tp agak mahal tp okelahh masbro"
safitriz,"Saya selalu memakai nature Republic karena cocok dan sangat membantu mempermudah membersihkan makeup setelah beraktifitas seharian penuh jadi kalau malas cuci muka saya selalu pakai kni agar lebih cepat dan praktis, membuat kulit saya lembab juga"
sellyaja,"Saya selalu memakai nature republic karena cocok dan sangat membantu mempermudah membersihkan makeup setelah beraktifitas seharian penuh jadi kalau malas cuci muka saya selalu pakai kni agar lebih cepat dan praktis, membuat kulit saya lembab juga"
ayuputrikay,"adem banget awal pemakaian, sangat melembabkan, kulit wajah berasa jadi kenyal, kulit menjadi sehat, dan bisa mencerahkan. tidak hanya dipakai di wajah, juga bisa melembabkan area badan yang kasar seperti siku, lutut, dan telapak kaki"
kylaarh,bagus untuk skin barrier cocok buat yg kulit sensitif ada cooling sensationnya ga bikin iritasi justru kalo lgbiritasi pake ini kulit muka jadi bakalan calming nenangin gak breakout lagi huhuu suka bgt bgt bgtttt sama produk yg satu iniiii
putriselvia,"bagus, barang sangat recommended untuk kulit wajah remaja membuat kulit menjadi smooth kenyal sehat segar. Wajib untuk dibeli barang sangat berfungsi recommended. Tampilkan segar dengan skincare terbaikmu sekarang juga. Sangat Bagus"
PrillyAulya,"Untuk tekstur cair dan mudah meresap di kulit , ada sensasi dingin di kulit yg bikin nyaman banget . Dan untuk yg punya masalah kulit berjerawat gaperlu worry karna ini bagus banget buat daily tiap kali abis cuci muka dan dipakai sebelum tidur."
flzhrasva,"Produk kecantikan ini benar-benar memberikan hasil yang memuaskan! Teksturnya ringan dan mudah meresap ke kulit, membuat wajah terasa lembap dan segar sepanjang hari. Selain itu, aroma yang disuguhkan juga sangat menyegarkan. Saya merasa kulit saya lebih halus dan bercahaya setelah pemakaian rutin. Sangat rekomendasi untuk dicoba"
Lailatuing,Lembab banget pakenya sukaa pasti rekonen beli lagi sudah jodoh cocok kalo aku. Siapa yang nggak mau kann gemess.Teksture lembut dingin cocok segala usia mau mature remaja gass bos. Multifungsi pol. Yuk cobain semua wajib. Bisa beli dimana ajqa
yunitadashari,"ini holygrail dari 10 tahun lalu! bagus banget buat calming kulit yang lagi jerawatan, redness, atau abis exfo. aku pake ini basically buat seluruh badan aku dan aman aman aja. aku juga pake buat underarm setelah aku waxing biar kulitnya jadi calm! best sih"
denyasf,"pernah pake ini melembabkan banget cocok buat skin barrier apalagi buat remaja, kulit jadi lembab dan kenyal, rekomen dipake malam, cocok juga buat skin prep sebelum mekap atau daily use cocok bgt. rekomen buat kulit remaja atau dewasa juga ok"
ajengfaradilla,"Pertama kali pake ini tuh kek nyaman banget bikin kulit jadi gaa kering, lembab, apalagi dipake pas sebelum make up itu bikin makeup jadi flawless, harga nya juga tejangkau, pemakaian jangka panjang aman aman aja ga ada iritasi apapun, terimakasiii"
Antooo,Overallsuka banget dan kenapa bisa repurchase bolak balik soalnya emang secinta itu akuh lohDan terimakasih sudah membuat prodak yang bagus banget pake banget banget pokoknya. Love bangetAku bakal terus repurcahse yaaaaaTerimakasih ya
