Username,Reviews
nisrinazakiyah,"Bagus banget, aku makenya sangat mudahhh, truss kental banget enak di pakai, mudah di gunakan truss aman , dinginnnnnbangetttt, cocok buat ngelembabin trusssskakakaka bagus bgttttt cocok di akuuu pokonya kakiaaan harus cobaaaaaaa yaaa"
annisawulan,"bagus bangett bikin wajah jadi lembab bener bener wajah aku jadi ga kering lagi harganya juga murah sangat terjangkau buat kantong pelajar ini bener bener andalan aku deh selalu beli ini ga pernah ganti, teksturnya juga ga bikin lengket di wajah"
destyapuspitasari09,"Bagus banget, aku makenya sangat mudahhh, truss kental banget enak di pakai, mudah di gunakan truss aman , dinginnnnnbangetttt, cocok buat ngelembabin trusssskakakaka bagus bgttttt cocok di akuuu pokonya kakiaaan harus cobaaaaaaa yaaa"
Tasya_yasinki,Produk ini bikin soothing kulit dan mengurangi kemerahan disemua bagian tubuh selain melembabkan juga menjaga elastisitas kulit aku saat diluar atau didalam ruangan yang berAC ga bikin jerawatan dikulit kombinasi aku sangat worth it loh
zanni,Cocok banget dikulitkuMembuat halus dan lembut serta kenyalTidak lengketTidak berbau menyengatHarga dan kualitas sesuaiKemasan pun juga simple dan di desain sempurnaSangat recommended tidak perlu diragukan lagiPokoknya luvv banget❤
novitakna,"Nature Republic Aloe Vera Gel banyak disukai karena praktis dan multifungsi. Teksturnya ringan, gampang meresap, dan nggak lengket, jadi nyaman dipakai sehari-hari. Kamu bisa pakai ini buat pelembap wajah, masker rambut, atau meredakan kulit yang kepanasan habis kena matahari. Kalau mau lebih segar, simpan di kulkas dulu sebelum dipakai. Kandungannya 92% aloe vera, jadi lumayan alami dan kasih efek sejuk di kulit. Tapi, buat kulit kering atau sensitif, kadang ada yang ngerasa kurang lembap atau iritasi karena ada kandungan alkohol. Secara keseluruhan, produk ini worth it buat dicoba, apalagi harganya terjangkau dan isinya banyak"
Ethalucy,"BagusCocok buat kulitGa lengket ga bikin keringCocok buat bagian kulit yang kering banget jugaWanginya juga enak, lembut juga dingin gitu gelnyaHarga terjangkau bangetBisa di dapetin di store mana ajaPokoknya reccomended banget sih"
Yohana27,Nature Republic moisturizer melembabkan kulit dan mengkencangkan kulit. sehingga menjadikan kulit lebih fresh dan kenyal. Cocok digunakan setiap hari terutama saat muka kemerahan. Teksturnya gel.luvvvvv kecintaanku Nature Republikk
chelia15,bagusss banget gatau lagi aku mau gimana lagi desckripsiin nyaaa dia tuh bener bener yang bagus banget buat lembapin muka akuuu aku jujur ya aku tuh bruntusan parah pas make dia ruh yang bener bener lngsung ke calming kemerahan jerawatan aku
Cindyy98,Saya pertama ragu pemakaian karena takut tidak cocok ternyata setelah dipakai bisa cocok dengan kulit muka saya dan ini terkadang bisa dipakai untuk siku tangan dan lutut kaki saya. Jadi saya rekomendasi sekali product Nature Republic untuk dipakai
graceveronica09,"memakaiii ini saya sangat senangggg bangeytyt, karena inii sangat melembabkannn muka saya, saya itu jerawatan trus memakai ini jerawat dan kemerahann saya sangatt berkurangg. saya sangat senang dan akan restok terus meneruss karena ini sangat bagus bagi saya"
florence1804,SUKA BANGETTTT SAMA nature republiccc aloeveraaaaaa favorittt akuuu sampai kapan punnmm sukakkkkkkkkk bangettttt dan calm bangettt mukaku setelah apply iniiiiiiiiiii repurchase andalannnn akuu everydayyyyyyyyyyyyyyyyyyyyyyyyy
ceshiemiaw,"produknya sangat ok, aku pakai ini karena disarankansamatemen aku terus produkini juga affordable dan tentunya gampang banget di temuin di sekitar rumah aku, pokonya cocok banget sama aku deh produk ini, sangatcocok dan murah bangeeet"
aldzanniesuci,Sangat bagus untuk kulit kemerahan dan bsa digunakan sebagai moisturizer juga base makeup/ skincare . Murah dan juga dapat di flash saleee diskonnya besar ukurannya besarr. Dapat harga bundling dengan produk lainnya yang semakin okee juga ukurannya yang pas untuk dpakai jangka lama
jesicafeb__,"Reaaly like this product, fungsinya banyak banget, jadi moist bisa. Buat body lotion bisa, buat rambut bisaa. Kereeeennnn. Apalagi yang punya kulit sensitif, kalo merah merah, tinggal pake aja langsung heal kulitnya ekekwkwk wajibbb punya"
novia_rhmh,"Awet banget, jumlahnya yang banyak dipakai sedikit juga muka udah lembab menyeluruh, kulit terhidrasi, ga begitu lengket, non parfumed, dipakai buat campuran masker juga oke banget loh, worth the price buat kualitas mantap gini, packaging juga aman secure."
fiaazahra,bener2 bikin muka halus banget setelah pake ini. teksturnya gel gitu pas dipake ada sensasi dinginnya bikin muka seger biasa pake dimalam hari bikin muka enak dipegang besoknya pokoknya rekomen banget produk ini must have apalagi untuk aku yang kulitnya berminyak
aisyhdewi,Aku suka bangetpake ini karna bikin kulit menjadi lembap dan ngak bikin keing di muka dan aku juga sangat menyukai produkink ngak bangetsoalnya aku uka bangeg dan ngak bikin risih dimuka teksturnya yang lembut dan ringan jadi aku suka banget pake
gesfia,"Berikut beberapa review produk Nature Republic:Produk Terfavorit1. *Soothing & Moisture Aloe Vera Foam Cleanser*: Sabun cuci muka yang lembut dan menyegarkan, cocok untuk kulit sensitif ¹.2. *Jeju Sparkling Mud Foam Cleanser*: Membersihkan kulit secara mendalam tanpa menghilangkan kelembapan alami ¹.3. *Aloe Vera 92% Soothing Gel*: Gel pelembap yang ringan dan tidak lengket, cocok untuk kulit kering dan sensitif ²[4).Manfaat- Melembabkan dan menenangkan kulit- Mengurangi peradangan dan kemerahan- Membantu mengencangkan kulit- Cocok untuk kulit sensitif dan normal ³Produk Lainnya1. *Snail Solution Emulsion*: Mengandung 70% snail secretion filtrate, membantu mencerahkan kulit ¹.2. *Collagen Dream 70 Cream*: Mengandung 70% kolagen, membantu mengurangi tanda-tanda penuaan ¹.3. *Ginseng Gold Silk Watery Cream*: Mengandung ginseng merah, membantu menghidrasi dan mengencangkan kulit ¹."
SitiTuminah,"Produk ini sangat direkomendasikan.. mantep produknya melembabkan kulit banget. Bisa di pakai semua kulit, apalagi yang kasar-kasar.. buat luka pun juga bisa karna jadi bikin cepet kering.. murah, ukurannya gede banget bisa buat berbulan-bulan"
zhwaul,selama pengalaman saya tentang produk ini saya merasa puas karena sangat bermanfaat untuk saya. Saya merasa produk ini terjangkau harganya dan memiliki manfaat yang luar biasa. Saat saya baru menggunakan produk ini saya sudah merasa cocok dengan produk ini.
Niar46,Pertama kali coba ini pas kondisi kulit qajah saat itu emang jerawatan terus pakailah produk ini dan entah aku yang salah atau emang harus rutin repurchase kaliyaa pas aku udh gakpakee breakout gak karuan bener2 gakmau pake ini lagi untuk diwajah akhirnya pakai ini untuk kulit tangan atau area2 yang kering aja
silaaaaaaa,"Udah pakeproduk ini lama banget, belimu awetdan nyaman banget kalo dipakaisebelum makeup. Bisa juga sebagai pengganti moisturizer, dengan harg yang relatif ekonomis dan terjangkau membuat ini ini sangat well recommended.good luck. ."
natalia_22,"Produk yang sangat bagus, dari awal kemunculannya sangat penasaran dan saya sudah mulai mencobanya. Sangat bagus untuk kulit wajah saya. Biasanya saya gunakan di wajah dan di rambut. Saat terkana kuliat wajah langsung terasa sensasi dinginya yang membuat rileks"
tamarazzn,bagus banget produknya👌sangat berguna di kulit kering aku yang butuh moiiissturise.gel nya ga lengket dan shooting pas kena burn skin bagus dipake pas malem hari jadi ga ganggu aktifitas suka karna jarnya gede dan bsa di reusable lagi deeehh
Aininaar,Pengalaman saya menggunakan produk ini sangat rekomenden dari segi produk. Yang membuat saya menjadi ingin membelinya lagi. Muka menjadi sangat lembab dan cocok untuk semua kulit. Saya membeli barang di online store yang sangat rekomend ya
ddharaw13,Suka banget pakai produk ini dari tahun 2020 dan selalu repurchased berkali kali karena emang sebagus itu. Produknya cepet banget menyerap di kulit wajah dan bagus banget buat meredakan kulit yang lagi kemerahan di muka apalagi saat jerawat
sifa_kartika,"Rasa nya gelly gitu, dingin menenangkan saat tersentuh kulit wajah, bisa ngempesin jerawat, biasanya aku pakai sebelum tidur, jadi saat pagi hari rasanya lembab dan fresh. Tidak terasa gatal saat digunakan, trus juga ga terlalu lengket saat terkena kulit wajah."
natme1004,Aloe vera gel dari nature republic ini yang paling aku sering pake entah dari tahun kapan.. Apalagi kalau habis panas-panasan muka auto kemerahan jadi langsung usap aloe veta gel seketika rasanya dingin ada efek soothing gitu lahhh.....
apilsss,"Ini selalu saya pakai setiap hari khususnya saat pagi karna emg melembab kan kulit ya, lalu tekturnya emg lembut dan menenangkan gitu pokoknya ya, cocok banget buat kulit kering dan tidak sensitif aman buat segala macam jenis kulit. Aku termasuk kulit kering"
ddharaw,"Produknya cepet menyerap, bagus untuk menghidrasi kulit muka, meredakan kulit muka yang kemerahan dan melembabkan kukit wajah. Sudah pakai dari tahun 2020 dan sampai sekarang masih repurchase terus sampai sekarang dan bakal rephurchuse terus"
nah_yeer,"The gel absorbs quickly without leaving a sticky residue, making it suitable for hot and humid climates. It works well for oily and combination skin due to its non-comedogenic formula, though users with very dry skin may find it insufficient for deeper hydration. Overall, Nature Republic moisturizers are a great pick for those seeking a budget-friendly, refreshing, and multi-purpose skincare product, especially for everyday hydration and soothing."
rifkamil,"Review Nature Republic Aloe Vera GelNature Republic Aloe Vera 92% Soothing Gel adalah salah satu produk perawatan kulit yang sangat populer, terutama bagi mereka yang mencari solusi multifungsi berbahan alami. Produk ini mengandung 92% ekstrak lidah buaya organik dari California, yang dikenal memiliki manfaat menenangkan, melembapkan, dan memperbaiki kulit.Teksturnya berupa gel ringan dengan aroma segar khas aloe vera. Ketika diaplikasikan, gel ini memberikan sensasi dingin yang menenangkan, cocok untuk kulit yang kering, teriritasi, atau terbakar matahari. Produk ini juga cepat meresap tanpa meninggalkan rasa lengket, sehingga nyaman digunakan untuk semua jenis kulit, termasuk kulit berminyak.Keunggulan lainnya adalah sifat multifungsinya. Gel ini dapat digunakan sebagai pelembap wajah, masker, perawatan rambut, hingga pelembap untuk tubuh. Selain itu, kandungannya bebas dari alkohol dan paraben, sehingga aman untuk kulit sensitif.Namun, beberapa pengguna mungkin mengalami reaksi ringan seperti berjerawat jika kulit mereka tidak cocok"
aslasworld,"Produknya sangat mengidrasi dan ketika kulit kita yg lagi kering atau sensitif rasanya langsung ke hidrasi. Gelnya pas di apply ga sticky, recommended bgttt pokoknyaa!!!💖💖💖🫶🏻Untuk wanginya ga yang bekitu menyengat krn dia aloe vera"
azzahrara_,"seneng banget pakai ini, pas dipakai ke kulit rasanya tuh dinginnn, terus bikin ngelembapin bgt, menyerap nya jg cepet gak perlu lama-lama. Kalo lagi beruntusan cocok pakai ini, btw kulit ku itu normal to dry!"
Veni_lee,Sesuka itu sih sama produknya ini karena demen banget sama isinya yang okay dan calming banget bikin aku pengen lagi dan lagi sih sama produknya yang okay banget ini. Dan menenangkan banget sihh diwajah aku rekomendasi banget sih produk kayak gini
selshdq,"Produknya menenangkan, cocok untuk kulit berminyak, cocok untuk kulit kusam, kemerahan. Bisa mencerahkan kulit dan menenangkan. Selain untuk wajah, bisa juga untuk dijadikan sebagai body lotion. Selain itu bisa juga digunakan untuk rambut"
ceunisa,"Melebutkan ke seluruh tubuh, dan sudah saya lama pemakaian, sekeluarga saya pun memakai ini sangat recomended sekali. Todak menyesal dengan pemakaian produk ini dan bagus sekali. Sudah menghabiskan 5 cocok sekali di keluarga besar saya"
zarinan,"sangat melembabkan untuk kulit ku yang dangat kering, dan juga menutrisi kulit, kulit menjadi lebih kenyal dan juga cerah. untuk harganya juga terjangkau, tidak terlalu murah dan mahal, pas untuk harga pelajar dan mahasiswa. sangat rekomended"
rarafd,"Udah pake ini dari 2018 sampe sekarang gak bisa moveon! Masih jadi top produk yang aku pilih, biasanya pake untuk calming skin habis panas panasan, kulitku tipe yang sensitif jadi suka merah merah, pake aloe natrep langsung bisa bikin redness pudar, love it !"
alcholicpink,Pertama kali pake cukup 1x di malam hari untuk mendapat kan kulit yg tampak lembab dan kenyal .Kulit jadi lebih lembab dan tampak kenyal jika pemakaian rutin untuk aktifitas sehari2 . Harus rajin jika ingin mendapatkan hasil yg terbaik .love u
noorahmawaty,"Bagus bgt buat kulit, relax banget dikulit, bisa buat rambut juga, pokoknya ini produk banyak kegunaaannya, cinta banget aaa...................Selain itu mudah didapatkan dimana saja, banyak diskon juga dan yang pasti nya lama habis nya"
nfitriannas,"Enaak bangeetttt,lembab,murceee wajib cobaiinnnn kleaannn Harus banget cobain Highly recomended jangan sampe ga nyobain yaaaaCocok banget buaat kulit normal, ato berjerawatKarena lembab bangeetttttt pake iniiiiApalagi kalo di pakai maleemm"
Sk090090,Barang nya ok dipake muka lbh glowing dan berchaya serinng purcahse ini Barang nya ok dipake muka lbh glowing dan berchaya serinng purcahse iniBarang nya ok dipake muka lbh glowing dan berchaya serinng purcahse inoBarang nya ok dipake muka lbh glowing dan berchaya serinng purcahse ino
elsaserevina,"Hmmm, awalnya aku beli ini karenq ikut2an temenku sih. Tapi setelah aku cobain behhhhh bukan lagiiiiii langsung buat kulit aku kenyel kenyel gitu kayak b*kng bayi hehehehee.Sampa aku pakai ini apalagi dimalam hari sensasinya dingin."
sanatia14,"Pake moisturizer dari nature republic ini sudah sangat sangat lama, karna moisturizer ini benar benar sangat melembapkan, selain itu bisa dipake diseluruh badan dan gabikin lengket, wanginya juga tidak mengganggu, pokoknya sangat highly recommended"
firdaandini,"Nature Republic Aloe Vera Soothing Gel multifungsi untuk melembapkan kulit, menenangkan iritasi, dan mendinginkan. Teksturnya ringan, cepat meresap, tapi bisa terasa lengket jika dipakai terlalu banyak. Harganya worth it to repurchase"
windaaay,Produk baguuu suka pake dari dulu dan cocok untuk kulit lembab saya akan beli lagi untuk pemakaiian dayilu sayaa salah satu produk yg saya pakai saya juga akan belo lagiii karena komposisi nyabagus Produk baguuu suka pake dari dulu dan cocok untuk kulit lembab saya akan beli lagi untuk pemakaiian dayilu sayaa salah satu produk yg saya pakai saya juga akan belo lagiii karena komposisi nyabagus
Nyuvita,Pengalaman memakai produk nature republij sangatlah bagus dimana aku memiliki kulit yang lumayan sensitif dan juga berminyak tapi dengan pemakaian produk dari nature republik ini sangat lah memuaskan aku sebagai pecinta dari product naturer republik repurchese always thanks nature republik
agnes_siska,"Kulit pernah terasa sangat kering dan ini bagus banget untuk melembapkan kulit. Selain itu bisa dipakai juga ketika kulit terkelupas apalagi saat kulit terpapar sinar matahari yang berlebih, tinggal di oleskan ada sensasi dingin lalu cepet recovery"
nilasari29,"Produk nya suka banget, bisa suka aku pake dipagi hari dan malam hari sebelum tidur, wajah jadi super lembab, jadi gak pernah jerawatan, komedo juga berkurang gitu, aku hampir pakai di semua bagian wajah seperti kulit wajah, alis dan bulu mata"
Deewiwulandari91,baguuus cocok bgt dan suka sama di kulit buat bersih bahuuuuuuuuusssssss bgttttttt kereeeeeenp dan juga bakalan beli lagi buat pemakaiiaan daily cocok di muka saya yang bandel bermingak dan buat sehat kulit kuuuu thank u fd yaaa
mayda_,"Moisturizer ini aku rasa sangat enak di wajah aku ngelembapin dan membuat wajah lebih halus, segar, cocok juga untuk maskeran kalau menurut ku, so kalian bisa coba ya, oh iya kalau beli di e-commerce lebih murah jadi lebih banyak promo. Engga buat iritasi"
Alfiani02,Bagus cocok di muka saya selama pemakaian Cocok untuk pemula bagus bagus bagus keren keren kerenkeren keren keren keren keren keren keren bagusnagus bagus bagus cocok cockk cocok cocok cocok cocok cocok cocok cocok baget di muka keren keren bagus
syifamaulydia,"produk ini sangat bermanfaat dan membuat kulit menjadi lebih sehat, cerah, dan lembab. lalu juga produk ini sangat recommended buat kalian yang memiliki permasalahan kulit kering, beruntusan, dan kusam. dia membuat kulit menjadi lebih moisturizing."
indah110505_,"Bagusss sekalii, sangatt cocok, sanagat rekomen untuk banyak orangggBisa digunakan semua jender baik perempuan maupun pria. Dapat melembabkan kuliat yg kering, iritasi dan merahmerahSangatttttt rekomennnnnn yaa guyssssssssssssss"
silvianirahayu,"Bagusss sekalii, sangatt cocok, sanagat rekomen untuk banyak orangggBisa digunakan semua jender baik perempuan maupun pria. Dapat melembabkan kuliat yg kering, iritasi dan merahmerahSangatttttt rekomennnnnn yaa guyssssssssssssss"
putamaliafn,"baguss banget udh langganansuka banget aku senannharus beliwajib langgananmau banget aku mau beli lagi, beli pas promo, muka jadi lembut, berkilau, cerah, ga ada jerawat lagi, no komedo, udah 2 tahun pemakaian juga. pokoknya repurchase!"
dps1991,"Sangat cocok untuk kulit kombinasi, dan memberikan kelembapan pada kulit yang kombinasi, sangat rekomended untuk dicoba. Sangat cocok untuk kulit kombinasi, dan memberikan kelembapan pada kulit yang kombinasi, sangat rekomended untuk dicoba."
RefyaDiva,"aku suka banget pertama kali nyobain ini sangat bagus untuk mengcalmingkan jerawat dan beruntusan aku, btw kulit aku dry skin to sensitive skin jadi dangat susah untuk menemukan brand yang bagus untuk jenis kulit aku ini yang super sensitive"
Rin06,Cocok banget dimuka jadi tenang kulit wajah nya.Ini sangat di rekomendasikan buat kalian yang berwajah sensitif.Yang cuaca panas2an seharian diluar pake ini jaadi dinginBuruan di beli yaaaaaDan dapatkan promon menariknyaBuruaaan sebelum kehabisa
bbeu,"Bagus, terasa dingin di kulit, melembapkan, menyembuhkan luka iritasi, dapat dijadikan moisturizer. Isi nya banyak juga. Harganya murah dan terjangkau. Dapat di temukan di manapun. Packagingnya juga bagus harganya sesuai dengan kantong pelajar. Good"
ValarieSarah123,"Produk bagu ga lengket ukuran besar ga cepet abis wangi tahan lama bikin kulit lembab up to dua puluh empat jam ga lengket recommend to buy dan repurchase pastinya , ud pake lebih dari sepuluh jar dan bakal beli lagi karena bagus dan porduk korea"
Ellenlonika,"lembut di kulit, cocok untuk kulit sensitif karena light banget. Packaging bagus, di hari berikut kulit jadi lembab dan ada hasil bagus banget. aku suka pake jadiin pelembap wajah, masker tidur, atau bahkan after-sun care untuk meredakan kulit yang terbakar matahari."
indritsar,"Buat orang yang kerja di lapangan dan sering terpapar matahari, I seriously recommend this product.. kenapa? Karena cream nature republic ini penyelamat banget saat kulit lagi kebakar-bakarnya. Adem kalau dipake dikulit. Buat kulit yang kering juga cocok banget pake ini."
farisazzahwa,"Bagus, terasa dingin di kulit, melembapkan, menyembuhkan luka iritasi, dapat dijadikan moisturizer. Isi nya banyak juga. Harganya terjangkau Dapat di temukan di manapun. Packagingnya juga bagus harganya sesuai dengan kantong pelajar. Good"
Novadewanti11,"Hydrating buat seluruh jenis kulit, cocok untuk semua umur. Mamaku suka bngt ini, pakai setelah di amsukin kulkas. Dinging jadi bikin nyaman. Bisa buat base make up juga, gatau kenapa aku suka bngt skin care produk korea. Harganya worth it sama hasilnya."
lilianyputri,"Suka banget sama nature republic, dingin kalau dipake diwajah. Untuk wajah kering cocok bgtt pokoknya, bkin wajah lembab dan segerrr. Harusnyajuga enakk, selalu belii disiniiiii......Bagus banget pokonyaaaaaa, aku juga rekomendaskan ke temen2"
Firah08_,"Gaun semiformal yang saya beli sangat pas dan menonjolkan kepribadian saya. Gaun ini cukup serbaguna untuk acara kasual dan formal. Saya menerima banyak pujian saat mengenakannya"". ""Tamanu oil is a life saver for my skin. This is probably the most effective remedy for my acne"
NauraArmelita,"produk ini dapat membantu agar kulit muka kita menjadi lembab dan terjaga, mampu meredakan kemerahan muka akibat panas dan jerawat matang, serta produk ini dapat ditemukan di mana mana dan isi nya banyak maka dari itu dapat diiii gunakan dalam jangka aaktu panjang"
Julliaoktavn,"Bagus banget! Ini untuk kulit yg kering bisa jadi lembab , ga bikin jeriwitan semua cocok semua bisa pake ini, ini recomend banget buat semua nya, yuk cobain, krna sebagus itu dan semurah itu gila ga sii bagus banget! Yukk dicobaaaaa!!!!!!!"
fajar21_,"tekstur nya bagus banget thick tapi ga lengket udah gitu bagus banget buat kulit kering yang emang butuh moisturizer ini sangat direkomendasikan karena emg se worth itu buat di coba, u must try this one karena oke banget buat kulit kalian jangan lupa coba ya"
halmama,"Saya baru saja mencoba pelembab wajah yang memberikan hasil luar biasa untuk kulit saya. Teksturnya ringan dan mudah meresap tanpa meninggalkan rasa lengket. Setelah dioleskan, kulit terasa lembut dan kenyal sepanjang hari. Pelembab ini sangat cocok untuk kulit saya yang cenderung kering, karena mampu memberikan kelembapan intensif tanpa terasa berat di wajah.Selain memberikan kelembapan yang tahan lama, pelembab ini juga membuat wajah tampak lebih cerah dan sehat. Saya merasa kulit saya lebih segar dan tampak lebih bercahaya setelah beberapa kali pemakaian. Yang lebih menarik, produk ini memiliki formula yang tidak menyebabkan iritasi, meskipun kulit saya sensitif.Wangi yang ringan dan tidak mengganggu juga menjadi nilai tambah, membuat penggunaan pelembab ini menjadi lebih menyenangkan. Saya juga merasa bahwa produk ini cukup ekonomis karena hanya sedikit saja sudah cukup untuk menutupi seluruh wajah."
merrymerr,"Sudah lama pakai produk ini dan bagus banget di kulit jadi terasa lembab rutin di pakai pagi dan malam sebelum tidur, pembelian di store nature republic dan juga di offline store di sociolla, ini soothing gel ter the best bagus banget, bisa utk cewe cowo"
Imas285,Pakai ini karenaamawal untuk meredakan luka dan it's works akhirnya pakai ini terus untuk meredakan jerawat. Dan pakai ini kalau kena sirnar matahari...bikin dingin dan nyaman bangey buat kulit. Sukaaaa banget sama produk ini setiap beli pasti lebih dari satu
GitaJuli2707,"Bagus. produk perawatan kulit serbaguna yang terkenal akan sifat menenangkan dan melembapkannya. Teksturnya ringan, cepat meresap, dan membantu menenangkan kulit iritasi serta membuatnya lembut dan segar. Saya suka dan akan purchase"
Nabila_Khoirunnisa,"Bagus recommended , cocok, gamemiliki efek samping yang berbahaya, lembut, adem, creamy tekstur nya enak, tidak mengiritasi, terpercaya, tidak memiliki zat aktif yang berbahaya, khasiat nya ampuh, cocok di kukit muka yang berjerawat"
renandari,"Enak banget buat moizturising. Gel, ada efek dingin gitu jadi cocok buat soothing kalo lagi iritasi. Biasanya aku pakai di step terakhir skincarean, dan kalo lagi males skincarean full juga biasanya pakai ini aja jadiin overnight mask udah. Love it"
khorinasabila,"Siapa yg ga kenal nature republic yg pernah hits pada masanya dan aku salah satunya yg ikut teracuni pake produk ini jugaaa dan jujurrr ini bagussa buat kulit yg kering dan biasanya aku juga pake ini ga buat wajah aja tp aku suka pake ke tangan , rambut, dan kulit kulit yg keringg"
Fhany,"bikin halus banget pake produk ini, sampe sekarang tetep setia pake produk ini karna bisa dipake untuk sehari hari dan sangat bagus buat kulit aku yang cukup kering, buat kalian yang kering juga sangat rekomendasi deh pake ini aku saranin ampuh"
caniasuyani2,"baguss sekali membuat kulit menjadi semakin lembut, mulus serta memiliki sensasi menyegarkan pada kulit. selalu pakai ini setiap hari nya agar kulit mendapatkan nutrisi yang bagus. cocok dipakai untuk daily routine dan sangat ringan untuk diapliksikan"
claudeasyf,Bagus banget soalnya bikin kulit cerah selain itu teksturnya juga lembut poollll kalau ada kesempatan buat beli lebih banyak lagi sih thank you nature republic sudah menyediakan ini semuaa aku nyaman banget pake ini heheheh jauh banget
valenciaval,bagus bgt terus bikin fresh cerah deh dan bakal pakai produk itu terus terusan. kulit aku udh ga kering lagiiii . Ini aku belinya online sih dan peoduk juga aman waktu sampai di akunya hehehehe. Pokoknya rekomendasi banget deh buat kaliannnn
Clara0101,"Nature Republic adalah merek kecantikan asal Korea Selatan yang terkenal dengan produk berbahan alami dan fokus pada perawatan kulit. Produk mereka banyak diminati karena formulanya yang lembut dan cocok untuk berbagai jenis kulit, termasuk kulit sensitif. Berikut adalah review beberapa produk populer Nature Republic:Kelebihan:Mengandung 92% lidah buaya yang menenangkan kulit.Multifungsi: dapat digunakan sebagai pelembap wajah, masker, perawatan rambut, hingga after-sun gel.Cepat meresap dan tidak lengket di kulit.Kekurangan:Bisa menimbulkan iritasi pada kulit yang sangat sensitif terhadap lidah buaya atau bahan pengawet tertentu.Tidak sepenuhnya alami karena mengandung alkohol."
